{
  "generated_at_utc": "2026-09-28T18:45:29.682394+00:00",
  "next_refresh_estimate_utc": "2026-09-28T19:00:29.682394+00:00",
  "sources_status": {
    "soccer/eng.1": "no_fixture_in_board",
    "soccer/esp.1": "no_fixture_in_board",
    "soccer/ita.1": "no_fixture_in_board",
    "soccer/ger.1": "no_fixture_in_board",
    "soccer/fra.1": "no_fixture_in_board",
    "soccer/usa.1": "ok(0)",
    "soccer/uefa.champions": "no_fixture_in_board",
    "soccer/uefa.europa": "no_fixture_in_board",
    "soccer/uefa.nations": "ok(0)",
    "soccer/fifa.world": "no_fixture_in_board",
    "soccer/fifa.friendly": "ok(0)",
    "basketball/nba": "no_fixture_in_board",
    "football/nfl": "ok(0)",
    "baseball/mlb": "ok(0)",
    "hockey/nhl": "ok(0)"
  },
  "fixture_count": 0,
  "fixtures": []
}